{
  "blocked": false,
  "exit_code": 0,
  "failure_class": null,
  "files_changed": [
    ".claude/agent-memory/superpowers-v-spec-reviewer/MEMORY.md",
    ".claude/agent-memory/superpowers-v-spec-reviewer/impacted-map-globs.md",
    ".claude/agent-memory/superpowers-v-spec-reviewer/memory-frontmatter-and-universal-acs.md",
    "docs/superpowers/dogfood/2026-10-08-project-root-run-b-review.md"
  ],
  "gate_receipt": {
    "baseline_commit": "689e1dbc887eea5d4be107b49760751a1fb79c63",
    "diff_digest": "sha256:c31e487d61454135dd75d198bc72a4a876806c273f1a4847325a71b65d2eb91d",
    "exit_code": 0,
    "raw_stdout": "{\n  \"verdict\": \"pass\",\n  \"mode\": \"direct\",\n  \"baseline\": \"689e1dbc887eea5d4be107b49760751a1fb79c63\",\n  \"changed\": [\n    \".claude/agent-memory/superpowers-v-spec-reviewer/MEMORY.md\",\n    \".claude/agent-memory/superpowers-v-spec-reviewer/impacted-map-globs.md\",\n    \".claude/agent-memory/superpowers-v-spec-reviewer/memory-frontmatter-and-universal-acs.md\",\n    \"docs/superpowers/dogfood/2026-10-08-project-root-run-b-review.md\"\n  ],\n  \"allowed\": [\n    \"docs/superpowers/dogfood/2026-10-08-project-root-run-b-review.md\",\n    \".claude/agent-memory/superpowers-v-spec-reviewer/**\"\n  ],\n  \"violations\": [],\n  \"toolchain_artifacts\": []\n}\n",
    "realised_commit": "689e1dbc887eea5d4be107b49760751a1fb79c63",
    "verdict": "pass"
  },
  "retry_after_seconds": 0,
  "session_id": "",
  "status": "success",
  "summary": "Review Gate \u2014 deep, three passes against the spec, ADR rules 5-8 and AC-1..AC-3",
  "tests": {
    "command": "bash -c 'bash tests/test-project-root.sh >/dev/null && /usr/bin/python3 -B scripts/compound-v-triage-outcomes.py --selftest >/dev/null && echo floor-ok'\nbash -c 'for s in scripts/compound-v-*.py; do grep -q -- \"--selftest\" \"$s\" || continue; /usr/bin/python3 -B \"$s\" --selftest >/dev/null 2>&1 || { echo \"FAIL $s\"; exit 1; }; done; for t in tests/*.sh; do bash \"$t\" >/dev/null 2>&1 || { echo \"FAIL $t\"; exit 1; }; done; echo all-tests-ok'",
    "exit_code": 0,
    "failures": [],
    "scope": "full",
    "selected_count": 2
  },
  "violations": [],
  "worktree": ""
}
