{
  "blocked": true,
  "exit_code": 0,
  "failure_class": null,
  "files_changed": [
    "schemas/pre-eval-record.schema.json",
    "scripts/compound-v-preeval.py"
  ],
  "gate_receipt": {
    "baseline_commit": "b299eb8717e63955e9632d56cce983eaeb9bd661",
    "diff_digest": "sha256:5f63e2df3117ec75a866c813dcf29598752073047a63b9a550d23f79d55f1f87",
    "exit_code": 0,
    "raw_stdout": "{\n  \"verdict\": \"pass\",\n  \"mode\": \"worktree\",\n  \"baseline\": \"b299eb8717e63955e9632d56cce983eaeb9bd661\",\n  \"changed\": [\n    \"schemas/pre-eval-record.schema.json\",\n    \"scripts/compound-v-preeval.py\"\n  ],\n  \"allowed\": [\n    \"scripts/compound-v-preeval.py\",\n    \"schemas/pre-eval-record.schema.json\"\n  ],\n  \"violations\": [],\n  \"toolchain_artifacts\": []\n}\n",
    "realised_commit": "b299eb8717e63955e9632d56cce983eaeb9bd661",
    "verdict": "pass"
  },
  "retry_after_seconds": 0,
  "session_id": "",
  "status": "blocked",
  "summary": "Task A \u2014 record t3 block and --request-file",
  "tests": {
    "command": "/usr/bin/python3 -B scripts/lint-frontmatter.py .\nbash -c '/usr/bin/python3 -B scripts/compound-v-preeval.py --selftest >/dev/null && bash tests/test-engine-c-contract.sh >/dev/null && echo schemas-ok'\nbash -c '/usr/bin/python3 -B scripts/compound-v-preeval.py --selftest >/dev/null && bash tests/test-native-points.sh >/dev/null && echo preeval-ok'",
    "exit_code": 1,
    "failures": [
      "bash -c '/usr/bin/python3 -B scripts/compound-v-preeval.py --selftest >/dev/null && bash tests/test-engine-c-contract.sh >/dev/null && echo schemas-ok'"
    ],
    "scope": "impacted",
    "selected_count": 3
  },
  "violations": [],
  "worktree": "/Users/koristuvac/compound/superpowers-v/.claude/worktrees/wf_9e69b4b1-d27-2"
}
