{
  "blocked": false,
  "exit_code": 0,
  "failure_class": null,
  "files_changed": [
    ".claude/agent-memory/superpowers-v-spec-reviewer/MEMORY.md",
    ".claude/agent-memory/superpowers-v-spec-reviewer/review-job-bash-clamp.md",
    "docs/superpowers/dogfood/2026-10-08-detect-ui-noul-criteria-review.md"
  ],
  "gate_receipt": {
    "baseline_commit": "3265739535b249d0c260538da028e69bdd04cb89",
    "diff_digest": "sha256:4cd02f60e2c2354114c0c210c9820b2a970c2e1b03697f6582b7d2c4f34921e2",
    "exit_code": 0,
    "raw_stdout": "{\n  \"verdict\": \"pass\",\n  \"mode\": \"direct\",\n  \"baseline\": \"3265739535b249d0c260538da028e69bdd04cb89\",\n  \"changed\": [\n    \".claude/agent-memory/superpowers-v-spec-reviewer/MEMORY.md\",\n    \".claude/agent-memory/superpowers-v-spec-reviewer/review-job-bash-clamp.md\",\n    \"docs/superpowers/dogfood/2026-10-08-detect-ui-noul-criteria-review.md\"\n  ],\n  \"allowed\": [\n    \"docs/superpowers/dogfood/2026-10-08-detect-ui-noul-criteria-review.md\",\n    \".claude/agent-memory/superpowers-v-spec-reviewer/**\"\n  ],\n  \"violations\": [],\n  \"toolchain_artifacts\": []\n}\n",
    "realised_commit": "3265739535b249d0c260538da028e69bdd04cb89",
    "verdict": "pass"
  },
  "retry_after_seconds": 0,
  "session_id": "",
  "status": "success",
  "summary": "Review Gate \u2014 deep, three passes against the spec and AC-1..AC-3",
  "tests": {
    "command": "bash -c '/usr/bin/python3 -B scripts/compound-v-jev.py --selftest >/dev/null && echo floor-ok'\nbash -c 'for s in scripts/compound-v-*.py; do grep -q -- \"--selftest\" \"$s\" || continue; /usr/bin/python3 -B \"$s\" --selftest >/dev/null 2>&1 || { echo \"FAIL $s\"; exit 1; }; done; for t in tests/*.sh; do bash \"$t\" >/dev/null 2>&1 || { echo \"FAIL $t\"; exit 1; }; done; echo all-tests-ok'",
    "exit_code": 0,
    "failures": [],
    "scope": "full",
    "selected_count": 2
  },
  "usage": {
    "advisor_calls": 0,
    "backend": "claude",
    "cache_creation_input_tokens": 155205,
    "cache_read_input_tokens": 2657875,
    "input_tokens": 64,
    "measured": true,
    "output_tokens": 5193,
    "source": "workflow-transcript",
    "transcripts": [
      "agent-a247f26b035019829.jsonl",
      "agent-a7edbe7646d32c31b.jsonl",
      "agent-af846fe052ccb8ce9.jsonl"
    ]
  },
  "violations": [],
  "worktree": ""
}
