{
  "blocked": false,
  "exit_code": 0,
  "failure_class": null,
  "files_changed": [
    ".claude/agent-memory/superpowers-v-spec-reviewer/MEMORY.md",
    ".claude/agent-memory/superpowers-v-spec-reviewer/test-helper-shape.md",
    "docs/superpowers/dogfood/2026-10-08-vault-jev-classify-flat-arguments-review.md"
  ],
  "gate_receipt": {
    "baseline_commit": "4156e8936da26398de02fd696d17e5c5cf98bae9",
    "diff_digest": "sha256:1a1d093d5cb3ad940dd9c45c8cb3a542a1e758f1882d52971f092ad1b974eb87",
    "exit_code": 0,
    "raw_stdout": "{\n  \"verdict\": \"pass\",\n  \"mode\": \"direct\",\n  \"baseline\": \"4156e8936da26398de02fd696d17e5c5cf98bae9\",\n  \"changed\": [\n    \".claude/agent-memory/superpowers-v-spec-reviewer/MEMORY.md\",\n    \".claude/agent-memory/superpowers-v-spec-reviewer/test-helper-shape.md\",\n    \"docs/superpowers/dogfood/2026-10-08-vault-jev-classify-flat-arguments-review.md\"\n  ],\n  \"allowed\": [\n    \"docs/superpowers/dogfood/2026-10-08-vault-jev-classify-flat-arguments-review.md\",\n    \".claude/agent-memory/superpowers-v-spec-reviewer/**\"\n  ],\n  \"violations\": [],\n  \"toolchain_artifacts\": []\n}\n",
    "realised_commit": "4156e8936da26398de02fd696d17e5c5cf98bae9",
    "verdict": "pass"
  },
  "retry_after_seconds": 0,
  "session_id": "",
  "status": "success",
  "summary": "Review Gate \u2014 deep, three passes against the spec and AC-1..AC-4",
  "tests": {
    "command": "bash tests/test-vault-mod.sh\nbash -c 'for s in scripts/compound-v-*.py; do grep -q -- \"--selftest\" \"$s\" || continue; /usr/bin/python3 -B \"$s\" --selftest >/dev/null 2>&1 || { echo \"FAIL $s\"; exit 1; }; done; for t in tests/*.sh; do bash \"$t\" >/dev/null 2>&1 || { echo \"FAIL $t\"; exit 1; }; done; echo all-tests-ok'",
    "exit_code": 0,
    "failures": [],
    "scope": "full",
    "selected_count": 2
  },
  "usage": {
    "advisor_calls": 0,
    "backend": "claude",
    "cache_creation_input_tokens": 184824,
    "cache_read_input_tokens": 3035439,
    "input_tokens": 70,
    "measured": true,
    "output_tokens": 4583,
    "source": "workflow-transcript",
    "transcripts": [
      "agent-a68475f560f6b42c1.jsonl",
      "agent-ac9e8464be20f95d4.jsonl",
      "agent-aea423650ff136b83.jsonl"
    ]
  },
  "violations": [],
  "worktree": ""
}
