{
  "blocked": false,
  "exit_code": 0,
  "failure_class": null,
  "files_changed": [
    ".claude/agent-memory/superpowers-v-spec-reviewer/MEMORY.md",
    ".claude/agent-memory/superpowers-v-spec-reviewer/verifying-acceptance-criteria.md",
    "docs/superpowers/dogfood/2026-10-05-jev-review-fixes-review.md"
  ],
  "gate_receipt": {
    "baseline_commit": "58ab998de716d0d85f2a1e60a3661dd2f966c573",
    "diff_digest": "sha256:f7d9ab7bed8a5348b6c4227dd6efaf86287a42e0e769b4c2dfb78b49b17a19f5",
    "exit_code": 0,
    "raw_stdout": "{\n  \"verdict\": \"pass\",\n  \"mode\": \"direct\",\n  \"baseline\": \"58ab998de716d0d85f2a1e60a3661dd2f966c573\",\n  \"changed\": [\n    \".claude/agent-memory/superpowers-v-spec-reviewer/MEMORY.md\",\n    \".claude/agent-memory/superpowers-v-spec-reviewer/verifying-acceptance-criteria.md\",\n    \"docs/superpowers/dogfood/2026-10-05-jev-review-fixes-review.md\"\n  ],\n  \"allowed\": [\n    \"docs/superpowers/dogfood/2026-10-05-jev-review-fixes-review.md\",\n    \".claude/agent-memory/superpowers-v-spec-reviewer/**\"\n  ],\n  \"violations\": [],\n  \"toolchain_artifacts\": []\n}\n",
    "realised_commit": "58ab998de716d0d85f2a1e60a3661dd2f966c573",
    "verdict": "pass"
  },
  "retry_after_seconds": 0,
  "session_id": "",
  "status": "success",
  "summary": "Review Gate \u2014 three passes against the spec (amendments first) and AC-1..AC-5",
  "tests": {
    "command": "/usr/bin/python3 -B scripts/lint-frontmatter.py .\nbash -c 'for s in scripts/compound-v-*.py; do grep -q -- \"--selftest\" \"$s\" || continue; /usr/bin/python3 -B \"$s\" --selftest >/dev/null 2>&1 || { echo \"FAIL $s\"; exit 1; }; done; for t in tests/*.sh; do bash \"$t\" >/dev/null 2>&1 || { echo \"FAIL $t\"; exit 1; }; done; echo all-tests-ok'",
    "exit_code": 0,
    "failures": [],
    "scope": "full",
    "selected_count": 2
  },
  "violations": [],
  "worktree": ""
}
